{
  "schema_version": "sourceful.driver-package-source/v1",
  "package_id": "com.sourceful.driver.sdm630",
  "version": "1.1.3",
  "channel": "beta",
  "display_name": "Eastron SDM630",
  "identity": {
    "schema": "sourceful.hardware-identity/v1",
    "make": "driver_reported",
    "serial": "driver_reported_when_available",
    "host_fallbacks": ["mac", "endpoint"],
    "persistent_state_owner": "host"
  },
  "source": {
    "repository": "https://github.com/srcfl/device-drivers",
    "path": "drivers/lua/sdm630.lua"
  },
  "builder_id": "https://github.com/srcfl/device-drivers/blob/main/tools/driver_package.py",
  "device_matches": [
    {
      "manufacturer": "Eastron",
      "model_family": "SDM630",
      "variants": ["SDM630-Modbus"],
      "regions": []
    }
  ],
  "capabilities": {
    "telemetry": ["meter"],
    "control": []
  },
  "permissions": ["modbus.read"],
  "telemetry": {
    "schema": "sourceful.telemetry/v2",
    "sign_convention": "sourceful.site-import-positive/v1",
    "streams": [
      {
        "kind": "meter",
        "power_field": "w",
        "meaning": "Positive is grid import and negative is grid export at the site boundary."
      }
    ]
  },
  "commands": [],
  "read_only": true,
  "default_mode": {
    "strategy": "not_applicable",
    "description": "The meter exposes telemetry only and has no control state."
  },
  "lease_policy": {
    "required_for_control": false,
    "expiry_action": "not_applicable"
  },
  "rollback": {
    "strategy": "install_previous_verified_package",
    "state_owner": "host",
    "automatic": false
  },
  "compatibility": [
    {
      "target": "ftw-core",
      "artifact_id": "ftw.lua51.source",
      "host": {
        "product": "ftw",
        "min_version": "1.4.0",
        "max_version_exclusive": "2.0.0"
      },
      "runtime": {
        "name": "gopher-lua",
        "semantics": "lua-5.1",
        "version": "1.1.2",
        "abi": "gopher-lua-source-v1",
        "host_api": {
          "profile": "sourceful.host/ftw-core/v1",
          "min": 1,
          "max": 1
        }
      },
      "control_enabled": false
    },
    {
      "target": "blixt-l1",
      "artifact_id": "blixt.lua51.source",
      "host": {
        "product": "blixt-gateway",
        "min_version": "0.1.0",
        "max_version_exclusive": "1.0.0"
      },
      "runtime": {
        "name": "luajit",
        "semantics": "lua-5.1",
        "version": "2.1",
        "abi": "mlua-0.10-luajit21-source-v1",
        "host_api": {
          "profile": "sourceful.host/blixt-l1/v1",
          "min": 1,
          "max": 1
        }
      },
      "control_enabled": false
    }
  ],
  "artifact_inputs": [
    {
      "artifact_id": "ftw.lua51.source",
      "target": "ftw-core",
      "media_type": "application/vnd.sourceful.lua.source",
      "input_path": "drivers/lua/sdm630.lua",
      "transform": "copy",
      "extension": "lua"
    },
    {
      "artifact_id": "blixt.lua51.source",
      "target": "blixt-l1",
      "media_type": "application/vnd.sourceful.lua.source",
      "input_path": "drivers/lua/sdm630.lua",
      "transform": "copy",
      "extension": "lua"
    }
  ]
}
