{
  "schema_version": "sourceful.driver-package-source/v1",
  "package_id": "com.sourceful.driver.sungrow",
  "version": "1.3.3",
  "channel": "beta",
  "display_name": "Sungrow observe-only pilot",
  "identity": {
    "schema": "sourceful.hardware-identity/v1",
    "make": "driver_reported",
    "serial": "driver_reported_when_available",
    "host_fallbacks": ["mac", "endpoint"],
    "persistent_state_owner": "host"
  },
  "source": {
    "repository": "https://github.com/srcfl/device-drivers",
    "path": "packages/v1/sungrow/targets/ftw-observe.lua"
  },
  "builder_id": "https://github.com/srcfl/device-drivers/blob/main/tools/driver_package.py",
  "device_matches": [
    {
      "manufacturer": "Sungrow",
      "model_family": "SH-RT (Three-Phase Hybrid)",
      "variants": ["SH5.0RT", "SH6.0RT", "SH8.0RT", "SH10RT"],
      "regions": ["EU"]
    }
  ],
  "capabilities": {
    "telemetry": ["battery", "meter", "pv"],
    "control": []
  },
  "permissions": ["modbus.read"],
  "telemetry": {
    "schema": "sourceful.telemetry/v2",
    "sign_convention": "sourceful.site-import-positive/v1",
    "streams": [
      {
        "kind": "battery",
        "power_field": "w",
        "meaning": "Positive is charging and negative is discharging."
      },
      {
        "kind": "meter",
        "power_field": "w",
        "meaning": "Positive is grid import and negative is grid export at the site boundary."
      },
      {
        "kind": "pv",
        "power_field": "w",
        "meaning": "PV generation is negative because it reduces site import."
      }
    ]
  },
  "commands": [],
  "read_only": true,
  "default_mode": {
    "strategy": "not_applicable",
    "description": "The observe-only target never changes inverter state."
  },
  "lease_policy": {
    "required_for_control": false,
    "expiry_action": "not_applicable"
  },
  "rollback": {
    "strategy": "install_previous_verified_package",
    "state_owner": "host",
    "automatic": false
  },
  "compatibility": [
    {
      "target": "ftw-core",
      "artifact_id": "ftw.lua51.source",
      "host": {
        "product": "ftw",
        "min_version": "1.7.0-beta.1",
        "max_version_exclusive": "2.0.0"
      },
      "runtime": {
        "name": "gopher-lua",
        "semantics": "lua-5.1",
        "version": "1.1.2",
        "abi": "gopher-lua-source-v1",
        "host_api": {
          "profile": "sourceful.host/ftw-core/v1",
          "min": 1,
          "max": 1
        }
      },
      "control_enabled": false
    }
  ],
  "artifact_inputs": [
    {
      "artifact_id": "ftw.lua51.source",
      "target": "ftw-core",
      "media_type": "application/vnd.sourceful.lua.source",
      "input_path": "packages/v1/sungrow/targets/ftw-observe.lua",
      "transform": "copy",
      "extension": "lua"
    }
  ]
}
